{
  "format": "uconf/0.2",
  "product": {
    "id": "rivian-r2-2026",
    "make": "Rivian",
    "model": "R2",
    "year": 2026,
    "body": "Midsize electric SUV",
    "market": "US",
    "currency": "USD",
    "data_as_of": "2026-08-31",
    "sources": [
      "rivian_r2_2026_03_13",
      "rivian_r2_configurator_2026_08_31",
      "electrek_r2_configurator_2026_05_15",
      "insideevs_r2_configurator_2026_05_15",
      "riviantrackr_r2_guide_2026_08_01",
      "jalopnik_r2_configurator_2026_05_15"
    ],
    "disclaimer": "Independent buyer-side tool. Not affiliated with, endorsed by, or sponsored by Rivian or any manufacturer. Vehicle names and specifications are used nominatively to identify real products. Verify all pricing and eligibility with the seller and a tax professional before purchase.",
    "assembly": {
      "country": "US",
      "plant": "Normal, Illinois"
    },
    "delivery_order": [
      "Available now",
      "Spring 2026",
      "Late 2026",
      "2027"
    ],
    "calibration": {
      "published_fully_loaded_performance": 62745,
      "note": "InsideEVs reports a fully-equipped Performance w/ Launch Package at $62,745. Use to calibrate estimated option prices as they firm up."
    }
  },
  "groups": [
    {
      "id": "build",
      "label": "Build",
      "select": "one",
      "required": true,
      "role": "base",
      "default": "build.performance"
    },
    {
      "id": "paint",
      "label": "Paint",
      "select": "one",
      "required": true,
      "default": "paint.esker_silver"
    },
    {
      "id": "wheels",
      "label": "Wheels",
      "select": "one",
      "required": true,
      "default": "wheels.lt21_as"
    },
    {
      "id": "interior",
      "label": "Interior",
      "select": "one",
      "required": true,
      "default": "interior.black_crater"
    },
    {
      "id": "towing",
      "label": "Towing",
      "select": "many",
      "required": false
    }
  ],
  "options": [
    {
      "id": "build.performance",
      "group": "build",
      "label": "R2 Performance (Launch Package)",
      "vendor_code": "BLD-PRF2",
      "price": {
        "amount": 57990,
        "mode": "base",
        "confidence": "verified"
      },
      "effects": [
        {
          "spec": "drivetrain",
          "op": "set",
          "value": "Dual-motor AWD",
          "confidence": "verified"
        },
        {
          "spec": "hp",
          "op": "set",
          "value": 656,
          "confidence": "verified"
        },
        {
          "spec": "torque_lbft",
          "op": "set",
          "value": 609,
          "confidence": "verified"
        },
        {
          "spec": "zero_to_sixty_s",
          "op": "set",
          "value": 3.6,
          "confidence": "verified"
        },
        {
          "spec": "range_mi",
          "op": "set",
          "value": 330,
          "confidence": "verified"
        },
        {
          "spec": "adas",
          "op": "set",
          "value": "Autonomy+ hands-free, lifetime (Launch Package)",
          "confidence": "verified"
        }
      ],
      "delivery": {
        "window": "Available now",
        "confidence": "verified"
      },
      "copy": {
        "short": "656 hp dual-motor AWD, 330 mi, 0-60 in 3.6s.",
        "long": "Launch Package bundles Autonomy+ (lifetime), the Tow Package, a Launch key fob, and access to Launch Green paint — for a limited time.",
        "value_note": "The bundle math matters: Autonomy+ and the Tow Package ride free here. If you wanted both anyway, the real gap to Premium shrinks well below the sticker gap."
      },
      "provenance": {
        "sourceIds": [
          "rivian_r2_2026_03_13",
          "electrek_r2_configurator_2026_05_15"
        ],
        "confidence": "verified",
        "note": "Rivian press release 2026-03-11; Electrek 2026-05-15"
      },
      "visualStatus": "visually_configurable",
      "orderability": "orderable_now"
    },
    {
      "id": "build.premium",
      "group": "build",
      "label": "R2 Premium",
      "vendor_code": "BLD-PRM2",
      "price": {
        "amount": 53990,
        "mode": "base",
        "confidence": "verified"
      },
      "effects": [
        {
          "spec": "drivetrain",
          "op": "set",
          "value": "Dual-motor AWD",
          "confidence": "verified"
        },
        {
          "spec": "range_mi",
          "op": "set",
          "value": 330,
          "confidence": "verified"
        }
      ],
      "delivery": {
        "window": "Late 2026",
        "confidence": "verified"
      },
      "copy": {
        "short": "Dual-motor AWD, 330 mi.",
        "value_note": "Power figure unpublished as of data_as_of. $4,000 under Performance, but no Launch Package bundle — price the extras you'd add back."
      },
      "provenance": {
        "sourceIds": [
          "rivian_r2_2026_03_13"
        ],
        "confidence": "verified",
        "note": "Rivian press release 2026-03-11"
      },
      "visualStatus": "visually_configurable",
      "orderability": "notify"
    },
    {
      "id": "build.standard_rwd",
      "group": "build",
      "label": "R2 Standard RWD",
      "vendor_code": "BLD-STND2 / DTN-RWDS",
      "price": {
        "amount": 44990,
        "mode": "base",
        "confidence": "verified"
      },
      "effects": [
        {
          "spec": "drivetrain",
          "op": "set",
          "value": "RWD",
          "confidence": "verified"
        },
        {
          "spec": "range_mi",
          "op": "set",
          "value": 275,
          "confidence": "verified"
        },
        {
          "spec": "battery",
          "op": "set",
          "value": "Standard pack",
          "confidence": "verified"
        }
      ],
      "delivery": {
        "window": "2027",
        "confidence": "verified"
      },
      "copy": {
        "short": "The $44,990 entry point. 275 mi.",
        "value_note": "The anchor price, not the value pick — $3,500 more buys 70 extra miles of range one trim up."
      },
      "provenance": {
        "sourceIds": [
          "rivian_r2_product_2026_08_31",
          "riviantrackr_r2_guide_2026_08_01"
        ],
        "confidence": "verified",
        "note": "RivianTrackr buyer's guide; Rivian configurator"
      },
      "visualStatus": "visually_configurable",
      "orderability": "notify"
    },
    {
      "id": "build.standard_rwd_lr",
      "group": "build",
      "label": "R2 Standard RWD Long Range",
      "vendor_code": "BLD-STND2 / BAT-L02",
      "price": {
        "amount": 48490,
        "mode": "base",
        "confidence": "verified"
      },
      "effects": [
        {
          "spec": "drivetrain",
          "op": "set",
          "value": "RWD",
          "confidence": "verified"
        },
        {
          "spec": "range_mi",
          "op": "set",
          "value": 345,
          "confidence": "verified"
        },
        {
          "spec": "battery",
          "op": "set",
          "value": "Long Range pack",
          "confidence": "verified"
        }
      ],
      "delivery": {
        "window": "2027",
        "confidence": "verified"
      },
      "copy": {
        "short": "The range champion of the entire lineup: 345 mi.",
        "value_note": "The quiet winner. More range than the Performance for $9,500 less. If range is your constraint, the lineup's best answer is its second-cheapest trim."
      },
      "provenance": {
        "sourceIds": [
          "rivian_r2_2026_03_13",
          "riviantrackr_r2_guide_2026_08_01"
        ],
        "confidence": "verified",
        "note": "RivianTrackr buyer's guide"
      },
      "visualStatus": "visually_configurable",
      "orderability": "notify"
    },
    {
      "id": "build.standard_awd_lr",
      "group": "build",
      "label": "R2 Standard AWD Long Range",
      "vendor_code": "BLD-STND2 / DTN-AWD / BAT-L02",
      "price": {
        "amount": 51990,
        "mode": "base",
        "confidence": "verified"
      },
      "effects": [
        {
          "spec": "drivetrain",
          "op": "set",
          "value": "Dual-motor AWD",
          "confidence": "verified"
        },
        {
          "spec": "range_mi",
          "op": "set",
          "value": 330,
          "confidence": "verified"
        },
        {
          "spec": "battery",
          "op": "set",
          "value": "Long Range pack",
          "confidence": "verified"
        }
      ],
      "delivery": {
        "window": "2027",
        "confidence": "verified"
      },
      "copy": {
        "short": "AWD with the Long Range pack. 330 mi."
      },
      "provenance": {
        "sourceIds": [
          "rivian_r2_product_2026_08_31",
          "riviantrackr_r2_guide_2026_08_01"
        ],
        "confidence": "verified",
        "note": "RivianTrackr buyer's guide"
      },
      "visualStatus": "visually_configurable",
      "orderability": "notify"
    },
    {
      "id": "paint.esker_silver",
      "group": "paint",
      "label": "Esker Silver",
      "vendor_code": "EXP-ESV",
      "price": {
        "amount": 0,
        "mode": "delta",
        "confidence": "verified"
      },
      "render": {
        "hex": "#B9BCBF",
        "mesh_target": "body_paint"
      },
      "copy": {
        "value_note": "The only no-cost color in the palette. Every other choice is $1,000+ of paint."
      },
      "provenance": {
        "sourceIds": [
          "electrek_r2_configurator_2026_05_15"
        ],
        "confidence": "verified",
        "note": "Electrek 2026-05-15"
      },
      "visualStatus": "visually_configurable",
      "orderability": "orderable_now"
    },
    {
      "id": "paint.glacier_white",
      "group": "paint",
      "label": "Glacier White",
      "price": {
        "amount": 1000,
        "mode": "delta",
        "confidence": "estimated",